{"record_type":"claim","schema_id":"ghostrace.claim-record","schema_version":1,"event_id":"00000000-0000-4000-8000-000000000001","parent_event_id":null,"evidence":"direct","citations":["00000000-0000-4000-8000-000000000001"],"grammar_version":1,"template":"collector_started_observation","locale":"en","gap_behavior":"limit_interpretation","gap_limited":false,"statement":"Direct observation: collector started."}
